<?xml version="1.0" encoding="UTF-8"?>
<?xml-stylesheet type="text/xsl" href="argueza_transform.xsl"?>
<portfolio xmlns:xsi="http://www.w3.org/2001/XMLSchema-instance"
           xsi:noNamespaceSchemaLocation="argueza_schema.xsd">

  <home>
    <hero>
      <image src="../../../img/argueza.png" alt="Profile Picture"/>
      <name>Ervine Kirby V. Argueza</name>
      <description>Software Developer</description>
    </hero>
  </home>
  <about>
    <content> Hi! My name is Ervine Argueza, and I enjoy playing video games, editing, and coding simple projects.</content>
  </about>
  <resume>
    <educBackground>
      <ul>
        <li>Ecumenical Christian College (2010-2016)</li>
        <li>Ecumenical Christian College (2016–2020)</li>
        <li>Golden Olympus Colleges (2020–2022)</li>
      </ul>
    </educBackground>
    <hobbies>
      <title>Hobbies</title>
      <ul>
        <li>Gaming</li>
        <li>Editing</li>
        <li>Coding</li>
        
      </ul>
    </hobbies>
  </resume>
</portfolio>
